{
  "identity": "aaaaaaaaaaaaaaaaaaaaaaaaaaaaaaaaaaaaaaaaaaaaaaaaaaaaaaaaaaaaaaaa",
  "kind": "CONTENT",
  "version": 1,
  "expiresAt": "2026-10-17T00:00:00Z",
  "data": {
    "insight": {
      "summary": "Revenue beat expectations; guidance raised.",
      "sentiment": "POSITIVE",
      "sentimentScore": 0.72,
      "relevanceScore": 0.91,
      "catalysts": [
        {
          "type": "EARNINGS",
          "description": "Quarterly revenue above consensus."
        }
      ],
      "confidence": 0.86,
      "evidence": [
        "8a7b6c5d-4e3f-4a1b-9c8d-7e6f5a4b3c2d"
      ],
      "flags": []
    },
    "status": "RESULT"
  }
}
