{
  "identity": "95afef40-7d85-5b0a-9927-aab43b9cb974",
  "kind": "ARTICLE",
  "version": 1,
  "expiresAt": "2026-10-17T00:00:00Z",
  "data": {
    "status": "DONE",
    "articleId": "11111111-1111-4111-8111-111111111111",
    "processingIdentity": "aaaaaaaaaaaaaaaaaaaaaaaaaaaaaaaaaaaaaaaaaaaaaaaaaaaaaaaaaaaaaaaa",
    "reservedNanodollars": 0,
    "budgetDay": "2026-10-03",
    "event": {
      "eventId": "95afef40-7d85-5b0a-9927-aab43b9cb974",
      "eventType": "NEWS_ARTICLE_ENRICHED",
      "eventVersion": 1,
      "occurredAt": "2026-09-27T14:03:11.123Z",
      "source": "ai-insights",
      "correlationId": "3f1c2a9e-4b7d-4c8e-9f0a-1b2c3d4e5f60",
      "symbol": "NVDA",
      "payload": {
        "articleId": "11111111-1111-4111-8111-111111111111",
        "contentHash": "9f86d081884c7d659a2feaa0c55ad015a3bf4f1b2b0b822cd15d6c15b0f00a08",
        "enrichment": {
          "promptVersion": "news-insight.v1",
          "model": "provider-model-id",
          "modelVersion": "2026-09-01",
          "enrichedAt": "2026-09-27T14:03:11.123Z",
          "insight": {
            "summary": "Revenue beat expectations; guidance raised.",
            "sentiment": "POSITIVE",
            "sentimentScore": 0.72,
            "relevanceScore": 0.91,
            "catalysts": [
              {
                "type": "EARNINGS",
                "description": "Quarterly revenue above consensus."
              }
            ],
            "confidence": 0.86,
            "evidence": [
              "11111111-1111-4111-8111-111111111111"
            ],
            "flags": []
          }
        }
      }
    }
  }
}
